{
  "name": "learning-triangle",
  "version": "0.1.0",
  "description": "Balance explanation, practice, and feedback into a testable learning loop.",
  "purpose": {
    "problem": "Balance explanation, practice, and feedback into a testable learning loop.",
    "outcome": "Produce validated LearningPlan, PracticeLoop, FeedbackCriteria.",
    "inScope": [
      "LearningGoal",
      "Explanation",
      "Practice",
      "Feedback",
      "UnderstandingGap"
    ],
    "outOfScope": [
      "Provider-specific execution",
      "Unvalidated solution generation"
    ]
  },
  "thinkingHabit": "Convert understanding gaps into cycles of explanation, application, and correction.",
  "thinkingElements": [
    "LearningGoal",
    "Explanation",
    "Practice",
    "Feedback",
    "UnderstandingGap"
  ],
  "requiredInputs": [
    {
      "name": "elaboratedConcepts",
      "description": "The elaboratedconcepts required by Learning Triangle.",
      "required": true,
      "schema": {
        "type": [
          "string",
          "object",
          "array"
        ]
      }
    },
    {
      "name": "understandingGaps",
      "description": "The understandinggaps required by Learning Triangle.",
      "required": true,
      "schema": {
        "type": [
          "string",
          "object",
          "array"
        ]
      }
    },
    {
      "name": "learningGoal",
      "description": "The learninggoal required by Learning Triangle.",
      "required": false,
      "schema": {
        "type": [
          "string",
          "object",
          "array"
        ]
      }
    }
  ],
  "validation": [
    {
      "id": "LEARNINGTRIANGLE-V01",
      "description": "Required inputs must be present, relevant, and mutually consistent.",
      "condition": "required inputs pass the shared validation framework",
      "onFailure": "Return needs clarification with one prioritized question."
    },
    {
      "id": "LEARNINGTRIANGLE-V02",
      "description": "Material ambiguity and missing information must be surfaced.",
      "condition": "no blocking unknown is hidden",
      "onFailure": "Record the gap and stop dependent logic."
    },
    {
      "id": "LEARNINGTRIANGLE-V03",
      "description": "Inputs must satisfy registered dependency semantics.",
      "condition": "dependency outputs or validated equivalents are available",
      "onFailure": "Recommend the missing prerequisite."
    }
  ],
  "logic": [
    {
      "id": "LEARNINGTRIANGLE-L01",
      "description": "Identify and normalize the skill's thinking elements: LearningGoal, Explanation, Practice, Feedback, UnderstandingGap.",
      "condition": "each required element has evidence or explicit unknown status",
      "onFailure": "Request or record the missing element."
    },
    {
      "id": "LEARNINGTRIANGLE-L02",
      "description": "Apply the Learning Triangle relationship rules without introducing platform assumptions.",
      "condition": "relationships are explicit and testable",
      "onFailure": "Record the unsupported relationship."
    },
    {
      "id": "LEARNINGTRIANGLE-L03",
      "description": "Test contradictions, alternatives, and failure conditions.",
      "condition": "material alternatives are considered",
      "onFailure": "Reduce confidence and disclose the limitation."
    },
    {
      "id": "LEARNINGTRIANGLE-L04",
      "description": "Generate a schema-compatible evaluation and next-step recommendation.",
      "condition": "scores, reasoning, and transition are consistent",
      "onFailure": "Return incomplete rather than guessing."
    }
  ],
  "evaluation": {
    "criteria": [
      {
        "name": "GoalAlignment Score",
        "description": "Quality of goalalignment in the current reasoning.",
        "weight": 0.2
      },
      {
        "name": "Balance Score",
        "description": "Quality of balance in the current reasoning.",
        "weight": 0.2
      },
      {
        "name": "PracticeQuality Score",
        "description": "Quality of practicequality in the current reasoning.",
        "weight": 0.2
      },
      {
        "name": "FeedbackQuality Score",
        "description": "Quality of feedbackquality in the current reasoning.",
        "weight": 0.2
      },
      {
        "name": "Adaptability Score",
        "description": "Quality of adaptability in the current reasoning.",
        "weight": 0.2
      }
    ],
    "scoringScale": {
      "minimum": 0,
      "maximum": 4,
      "labels": {
        "0": "unusable",
        "1": "weak",
        "2": "partial",
        "3": "sufficient",
        "4": "robust"
      }
    }
  },
  "conversationRules": [
    "Ask one material question at a time.",
    "Separate facts, assumptions, and interpretations.",
    "Explain why a clarification affects the evaluation.",
    "Stop when inputs are sufficient."
  ],
  "output": {
    "schema": "../../schemas/output.schema.json",
    "extensions": {
      "scoreReporting": {
        "overall": "evaluation.score",
        "dimensions": "reasoning"
      }
    }
  },
  "neverRules": [
    "Never fabricate missing information.",
    "Never bypass a blocking validation failure.",
    "Never hide uncertainty behind a score.",
    "Never invoke an unsatisfied downstream skill."
  ],
  "nextSkill": [
    {
      "skill": "mind-map",
      "condition": "The current output satisfies the registered transition contract.",
      "reason": "Continue reasoning with MindMap."
    },
    {
      "skill": "deep-processing",
      "condition": "The current output satisfies the registered transition contract.",
      "reason": "Continue reasoning with DeepProcessing."
    }
  ],
  "examples": [
    {
      "name": "Valid case",
      "input": {
        "elaboratedConcepts": "Validated input",
        "understandingGaps": "Relevant context"
      },
      "expectedOutput": {
        "status": "sufficient"
      }
    },
    {
      "name": "Incomplete case",
      "input": {
        "elaboratedConcepts": "Ambiguous input"
      },
      "expectedOutput": {
        "status": "incomplete",
        "questionRequired": true
      }
    }
  ],
  "references": [
    {
      "title": "ThinkingOS Skill Specification",
      "citation": "../../docs/skill-specification.md"
    },
    {
      "title": "ThinkingOS Reasoning Engine",
      "citation": "../../core/engine.md"
    }
  ],
  "tests": [
    {
      "name": "learning-triangle-T01",
      "input": {
        "elaboratedConcepts": "valid input"
      },
      "expected": {
        "check": "successful evaluation"
      }
    },
    {
      "name": "learning-triangle-T02",
      "input": {
        "elaboratedConcepts": "missing required input"
      },
      "expected": {
        "check": "clarification"
      }
    },
    {
      "name": "learning-triangle-T03",
      "input": {
        "elaboratedConcepts": "ambiguous input"
      },
      "expected": {
        "check": "ambiguity detected"
      }
    },
    {
      "name": "learning-triangle-T04",
      "input": {
        "elaboratedConcepts": "contradictory input"
      },
      "expected": {
        "check": "contradiction recorded"
      }
    },
    {
      "name": "learning-triangle-T05",
      "input": {
        "elaboratedConcepts": "unsupported assumption"
      },
      "expected": {
        "check": "assumption disclosed"
      }
    },
    {
      "name": "learning-triangle-T06",
      "input": {
        "elaboratedConcepts": "dependency missing"
      },
      "expected": {
        "check": "prerequisite recommended"
      }
    },
    {
      "name": "learning-triangle-T07",
      "input": {
        "elaboratedConcepts": "alternative explanation"
      },
      "expected": {
        "check": "alternative tested"
      }
    },
    {
      "name": "learning-triangle-T08",
      "input": {
        "elaboratedConcepts": "boundary condition"
      },
      "expected": {
        "check": "boundary handled"
      }
    },
    {
      "name": "learning-triangle-T09",
      "input": {
        "elaboratedConcepts": "low evidence"
      },
      "expected": {
        "check": "confidence reduced"
      }
    },
    {
      "name": "learning-triangle-T10",
      "input": {
        "elaboratedConcepts": "complete input"
      },
      "expected": {
        "check": "output schema conformance"
      }
    }
  ],
  "extensions": {
    "goldenSkillCompatible": true,
    "documentation": {
      "workflow": "workflow.md",
      "validation": "validation.md",
      "evaluation": "evaluation.md",
      "rubric": "rubric.md",
      "examples": "examples.md",
      "tests": "tests.md",
      "references": "references.md"
    }
  }
}
